{
  "$schema": "https://json-schema.org/draft/2020-12/schema",
  "$id": "https://github.com/XingfenD/crearte/schema/game.schema.json",
  "title": "Crearte Game",
  "type": "object",
  "additionalProperties": false,
  "required": [
    "id",
    "name",
    "durationMinutes",
    "type",
    "tags",
    "addedAt"
  ],
  "properties": {
    "id": {
      "type": "string",
      "pattern": "^([a-z0-9]([a-z0-9-]{0,37}[a-z0-9])?/)?[a-z0-9]([a-z0-9-]{0,61}[a-z0-9])?$"
    },
    "user": {
      "type": "string",
      "pattern": "^[a-z0-9]([a-z0-9-]{0,37}[a-z0-9])?$"
    },
    "slug": {
      "type": "string",
      "pattern": "^[a-z0-9]([a-z0-9-]{0,61}[a-z0-9])?$"
    },
    "playSubdomain": {
      "type": "string",
      "pattern": "^[0-9a-f]{16}$"
    },
    "name": {
      "type": "string",
      "minLength": 1,
      "maxLength": 60
    },
    "url": {
      "type": "string",
      "pattern": "^https://[^\\s]+$"
    },
    "author": {
      "type": "object",
      "additionalProperties": false,
      "required": [
        "name"
      ],
      "properties": {
        "name": {
          "type": "string",
          "minLength": 1,
          "maxLength": 60
        },
        "url": {
          "type": "string",
          "pattern": "^https://[^\\s]+$"
        }
      }
    },
    "description": {
      "type": "string",
      "minLength": 1,
      "maxLength": 140
    },
    "intro": {
      "type": "string",
      "maxLength": 5000
    },
    "durationMinutes": {
      "type": "object",
      "additionalProperties": false,
      "required": [
        "min",
        "max"
      ],
      "properties": {
        "min": {
          "type": "integer",
          "minimum": 1
        },
        "max": {
          "type": "integer",
          "minimum": 1,
          "maximum": 600
        }
      }
    },
    "type": {
      "enum": [
        "puzzle",
        "action",
        "idle",
        "strategy",
        "simulation",
        "narrative",
        "music",
        "creative",
        "casual",
        "other"
      ]
    },
    "tags": {
      "type": "array",
      "maxItems": 8,
      "uniqueItems": true,
      "items": {
        "type": "string",
        "minLength": 1,
        "maxLength": 12,
        "pattern": "^\\S(.*\\S)?$"
      }
    },
    "cover": {
      "type": "string",
      "pattern": "^(https://[^\\s]+|/data/assets/covers/)"
    },
    "addedAt": {
      "type": "string",
      "pattern": "^\\d{4}-\\d{2}-\\d{2}$"
    },
    "runtime": {
      "enum": [
        "external",
        "virtual",
        "hosted"
      ]
    },
    "version": {
      "type": "string",
      "pattern": "^[a-z0-9][a-z0-9._-]{0,63}$"
    },
    "entry": {
      "type": "string",
      "pattern": "^[a-zA-Z0-9._/-]+$",
      "maxLength": 255
    },
    "playOrigin": {
      "type": "string",
      "pattern": "^(https://[^\\s]+|http://[a-z0-9-]+\\.localhost(:\\d+)?)$"
    },
    "hostedUrl": {
      "type": "string",
      "pattern": "^https://[^\\s]+$"
    },
    "bundle": {
      "type": "object",
      "additionalProperties": false,
      "required": [
        "url",
        "bytes",
        "sha256"
      ],
      "properties": {
        "url": {
          "type": "string",
          "pattern": "^(https://[^\\s]+|/data/bundles/)"
        },
        "bytes": {
          "type": "integer",
          "minimum": 1
        },
        "sha256": {
          "type": "string",
          "pattern": "^[0-9a-f]{64}$"
        },
        "enc": {
          "type": "object",
          "additionalProperties": false,
          "required": [
            "v",
            "alg",
            "kid"
          ],
          "properties": {
            "v": {
              "const": 1
            },
            "alg": {
              "const": "AES-256-GCM"
            },
            "kid": {
              "type": "string",
              "pattern": "^[A-Za-z0-9_-]{22}$"
            }
          }
        }
      }
    },
    "features": {
      "type": "object",
      "additionalProperties": false,
      "properties": {
        "eval": {
          "type": "boolean"
        },
        "inlineScript": {
          "type": "boolean"
        },
        "inlineStyle": {
          "type": "boolean"
        },
        "wasm": {
          "type": "boolean"
        },
        "coop": {
          "type": "boolean"
        },
        "fullscreen": {
          "type": "boolean"
        },
        "gamepad": {
          "type": "boolean"
        }
      }
    },
    "display": {
      "type": "object",
      "additionalProperties": false,
      "properties": {
        "aspect": {
          "enum": [
            "16:9",
            "4:3",
            "fill"
          ]
        }
      }
    },
    "fallback": {
      "enum": [
        "external",
        "hosted",
        "none"
      ]
    }
  },
  "allOf": [
    {
      "if": {
        "properties": {
          "runtime": {
            "const": "virtual"
          }
        },
        "required": [
          "runtime"
        ]
      },
      "then": {
        "properties": {
          "version": {},
          "bundle": {}
        },
        "required": [
          "version",
          "bundle"
        ]
      }
    },
    {
      "if": {
        "properties": {
          "runtime": {
            "const": "hosted"
          }
        },
        "required": [
          "runtime"
        ]
      },
      "then": {
        "properties": {
          "hostedUrl": {}
        },
        "required": [
          "hostedUrl"
        ]
      }
    }
  ]
}
