{
  "id": "hextris",
  "name": "Hextris",
  "url": "https://hextris.io/",
  "author": { "name": "Hextris Team", "url": "https://github.com/Hextris/hextris" },
  "description": "旋转六边形接住下落的彩色方块，速度越来越快的反应类游戏。",
  "durationMinutes": { "min": 3, "max": 15 },
  "type": "action",
  "tags": ["反应", "街机"],
  "addedAt": "2026-09-17"
}
