{
  "id": "fixture/hosted-demo",
  "user": "fixture",
  "slug": "hosted-demo",
  "name": "托管夹具",
  "url": "https://example.com/hosted",
  "author": { "name": "test" },
  "description": "fixture",
  "durationMinutes": { "min": 1, "max": 1 },
  "type": "other",
  "tags": ["fixture"],
  "addedAt": "2026-09-17",
  "runtime": "hosted",
  "features": { "inlineScript": true }
}
