{
  "id": "fixture/abs-paths",
  "user": "fixture",
  "slug": "abs-paths",
  "name": "绝对路径夹具",
  "url": "https://example.com/abs",
  "author": { "name": "test", "url": "mailto:test@example.com" },
  "description": "fixture",
  "intro": "夹具简介，外链：[示例站](https://example.com/intro-link)。",
  "durationMinutes": { "min": 1, "max": 1 },
  "type": "other",
  "tags": ["fixture"],
  "addedAt": "2026-09-17",
  "entry": "index.html",
  "display": { "aspect": "4:3" },
  "features": { "inlineScript": true }
}
