{
  "id": "fixture/revoked",
  "user": "fixture",
  "slug": "revoked",
  "name": "吊销夹具",
  "url": "https://example.com/revoked",
  "author": { "name": "test" },
  "description": "fixture",
  "durationMinutes": { "min": 1, "max": 1 },
  "type": "other",
  "tags": ["fixture"],
  "addedAt": "2026-09-17",
  "entry": "index.html",
  "fallback": "hosted",
  "features": { "inlineScript": true }
}
